{
  "$schema": "https://json-schema.org/draft/2020-12/schema",
  "$id": "https://github.com/tt-a1i/archify/schemas/business-flow.schema.json",
  "title": "Archify Business Flow Diagram",
  "type": "object",
  "additionalProperties": false,
  "required": [
    "schema_version",
    "diagram_type",
    "meta",
    "nodes",
    "edges"
  ],
  "properties": {
    "schema_version": {
      "const": 1
    },
    "diagram_type": {
      "const": "business-flow"
    },
    "meta": {
      "type": "object",
      "additionalProperties": false,
      "required": [
        "title"
      ],
      "properties": {
        "title": {
          "type": "string",
          "minLength": 1
        },
        "layout_direction": {
          "enum": [
            "horizontal",
            "vertical"
          ]
        },
        "subtitle": {
          "type": "string"
        },
        "output": {
          "type": "string"
        },
        "animation": {
          "enum": [
            "trace",
            "none"
          ]
        },
        "visual_preset": {
          "enum": [
            "classic",
            "signal-flow",
            "blueprint",
            "editorial"
          ]
        },
        "quality_profile": {
          "enum": [
            "standard",
            "showcase"
          ]
        },
        "views": {
          "$ref": "common.schema.json#/$defs/guidedViews"
        },
        "legend": {
          "type": "object",
          "additionalProperties": false,
          "properties": {
            "mode": {
              "$ref": "common.schema.json#/$defs/legendMode"
            },
            "entries": {
              "type": "object",
              "additionalProperties": false,
              "properties": {
                "start": { "$ref": "common.schema.json#/$defs/legendEntry" },
                "end": { "$ref": "common.schema.json#/$defs/legendEntry" },
                "process": { "$ref": "common.schema.json#/$defs/legendEntry" },
                "decision": { "$ref": "common.schema.json#/$defs/legendEntry" },
                "data-store": { "$ref": "common.schema.json#/$defs/legendEntry" },
                "document": { "$ref": "common.schema.json#/$defs/legendEntry" },
                "manual-input": { "$ref": "common.schema.json#/$defs/legendEntry" },
                "subprocess": { "$ref": "common.schema.json#/$defs/legendEntry" },
                "external": { "$ref": "common.schema.json#/$defs/legendEntry" }
              }
            }
          }
        },
        "viewBox": {
          "type": "array",
          "prefixItems": [
            {
              "type": "number",
              "minimum": 700
            },
            {
              "type": "number",
              "minimum": 240
            }
          ],
          "items": false,
          "minItems": 2,
          "maxItems": 2
        }
      }
    },
    "lanes": {
      "type": "array",
      "minItems": 1,
      "items": {
        "type": "object",
        "additionalProperties": false,
        "required": [
          "id",
          "label"
        ],
        "properties": {
          "id": {
            "$ref": "common.schema.json#/$defs/id"
          },
          "label": {
            "type": "string",
            "minLength": 1
          },
          "variant": {
            "enum": [
              "normal",
              "exception"
            ]
          }
        }
      }
    },
    "mainPath": {
      "type": "array",
      "minItems": 2,
      "items": {
        "$ref": "common.schema.json#/$defs/id"
      }
    },
    "nodes": {
      "type": "array",
      "minItems": 1,
      "items": {
        "type": "object",
        "additionalProperties": false,
        "required": [
          "id",
          "kind",
          "label"
        ],
        "properties": {
          "id": {
            "$ref": "common.schema.json#/$defs/id"
          },
          "kind": {
            "enum": [
              "start",
              "end",
              "process",
              "decision",
              "data-store",
              "document",
              "manual-input",
              "subprocess",
              "external"
            ]
          },
          "label": {
            "type": "string",
            "minLength": 1
          },
          "lane": {
            "$ref": "common.schema.json#/$defs/id"
          },
          "row": {
            "type": "integer",
            "minimum": 0,
            "maximum": 12
          },
          "col": {
            "type": "integer",
            "minimum": 0,
            "maximum": 7
          },
          "sublabel": {
            "type": "string"
          },
          "tag": {
            "type": "string"
          },
          "width": {
            "type": "number",
            "minimum": 48
          },
          "height": {
            "type": "number",
            "minimum": 44
          },
          "yOffset": {
            "type": "number"
          }
        }
      }
    },
    "edges": {
      "type": "array",
      "items": {
        "type": "object",
        "additionalProperties": false,
        "required": [
          "from",
          "to"
        ],
        "properties": {
          "id": {
            "$ref": "common.schema.json#/$defs/id"
          },
          "from": {
            "$ref": "common.schema.json#/$defs/id"
          },
          "to": {
            "$ref": "common.schema.json#/$defs/id"
          },
          "label": {
            "type": "string"
          },
          "variant": {
            "$ref": "common.schema.json#/$defs/variant"
          },
          "role": {
            "enum": [
              "main",
              "branch",
              "async",
              "return",
              "error",
              "yes",
              "no"
            ]
          },
          "fromSide": {
            "$ref": "#/$defs/side"
          },
          "toSide": {
            "$ref": "#/$defs/side"
          },
          "route": {
            "enum": [
              "auto",
              "straight",
              "drop",
              "outside-right",
              "return-left",
              "bottom-channel",
              "up-channel"
            ]
          },
          "via": {
            "type": "array",
            "items": {
              "$ref": "common.schema.json#/$defs/point"
            }
          },
          "labelAt": {
            "$ref": "common.schema.json#/$defs/point"
          },
          "labelDx": {
            "type": "number"
          },
          "labelDy": {
            "type": "number"
          },
          "labelSegment": {
            "type": "integer",
            "minimum": 0
          },
          "channelX": {
            "type": "number"
          },
          "channelY": {
            "type": "number"
          },
          "bias": {
            "type": "number",
            "minimum": 0,
            "maximum": 1
          },
          "width": {
            "type": "number",
            "minimum": 0.5
          }
        }
      }
    },
    "cards": {
      "$ref": "common.schema.json#/$defs/cards"
    }
  },
  "allOf": [
    {
      "if": {
        "properties": {
          "meta": {
            "type": "object",
            "properties": {
              "layout_direction": {
                "enum": [
                  "horizontal",
                  "vertical"
                ]
              }
            },
            "required": [
              "layout_direction"
            ]
          }
        }
      },
      "then": {},
      "else": {
        "properties": {
          "nodes": {
            "type": "array",
            "items": {
              "type": "object",
              "properties": {
                "row": {},
                "col": {}
              },
              "required": [
                "row",
                "col"
              ]
            }
          }
        }
      }
    }
  ],
  "$defs": {
    "side": {
      "enum": [
        "left",
        "right",
        "top",
        "bottom"
      ]
    }
  }
}
